id,title,title_english,type,source,episodes,status,airing,rating,score,rank,scored_by,popularity,favorites,members,synopsis,season,year,start,ending,studios,genres,ranking
37387,Wata no Kuni Hoshi Pilot,,Special,Manga,1,Finished Airing,False,G - All Ages,5.79,10983,302,14887,0,816,A pilot of Wata no Kuni Hoshi released only on the DVD of the film. It is entirely without dialogue.,,2007,2007-06-20,,Mushi Production,Fantasy,1171
21773,Sugar*Soldier,,Special,Manga,3,Finished Airing,False,G - All Ages,5.78,10985,5476,6298,10,11664,"Three episodes aired on TV as part of the Ribon x Oha Suta specials. 

Makoto is determined to step out of her model sister's shadow and have her own high school debut, but when Makoto's sister shows up at her school unexpectedly, things go awry. 

(Source: MU)",,2014,2014-01-14,2014-01-28,,Comedy;Romance,1172
3863,Sweet Valerian Specials,,Special,Original,8,Finished Airing,False,G - All Ages,5.78,10989,545,13298,0,1265,Eight DVD-only episodes.,,2005,2005-06-22,2005-09-28,Madhouse,Comedy,1173
23765,Yamiyo no Jidaigeki,,Special,Unknown,2,Finished Airing,False,R+ - Mild Nudity,5.78,10994,179,15726,1,648,"Tales include:

The Hill of Old Age, which tells of a conspiracy hatched against Japan's unifier, Oda Nobunaga. 

Seeing the Truth, about the assassin sent to murder Nobunaga's successor leyasu Tokugawa.

The broadcast was a part of the Neo Hyper Kids program. 

(Source: Anime Encyclopedia)",,1995,1995-02-19,,Sunrise,Horror,1174
28925,Youkai Watch: Best 10,,Special,Game,1,Finished Airing,False,G - All Ages,5.78,10996,257,14585,1,893,Countdown of the ten best Youkai Watch moments.,,2014,2014-12-19,,OLM,Comedy;Supernatural,1175
29835,47 Todoufuken Specials,,Special,Unknown,2,Finished Airing,False,G - All Ages,5.78,10999,127,17442,0,449,A two-part TV special focusing on the romance between the dogs.,,2012,2012-03-20,2012-06-30,Pollyanna Graphics,Comedy;Romance,1176
30289,Dededen,,Special,Original,5,Finished Airing,False,G - All Ages,5.78,11006,283,15535,1,678,"The studio TMS Entertainment collaborated with Seibu Railways on the new original anime Dededen. The anime celebrates both the 50th anniversary of TMS Entertainment and the 100th anniversary of Seibu Railways. TMS Entertainment happens to be located near the Araiyakushimae Station on the Seibu Shinjuku Line.

The anime followed the daily life of the main lead Amoru Tokorozawa and the railway. TMS plans to make five episodes, each 75 seconds long. It is running on the train's onboard SmileVision screens, as well as on the Smile StationVision screens around major stations from February 23 to December 31.

(Source: ANN)",,2015,2015-02-23,2015-12-14,TMS Entertainment,Slice of Life,1177
28959,Kizuna (Special),,Special,Original,1,Finished Airing,False,G - All Ages,5.77,11037,518,14316,2,958,Short animation by Tekken.,,2012,2012-01-01,,,Drama;Romance;Slice of Life,1178
27677,Stratos 4 OVA: Stratos 4.1 - Dutch Roll,,Special,Original,1,Finished Airing,False,PG-13 - Teens 13 or older,5.77,11050,299,13947,1,1060,This short episode comes along with the first episode of the OVA.,,2004,2004-05-28,,Studio Fantasia,Action;Sci-Fi,1179
30767,Wonder 3 Pilot,,Special,Unknown,1,Finished Airing,False,G - All Ages,5.77,11056,108,18191,0,394,Wonder Three pilot episode.,,1965,1965-01-01,,,Action;Adventure;Comedy;Sci-Fi,1180
23781,Blade & Soul Specials,,Special,Game,7,Finished Airing,False,PG-13 - Teens 13 or older,5.77,11063,2926,7209,0,8469,Short specials (featuring the chibi forms of the characters) included in the Blade and Soul Blu-rays and DVDs.,,2014,2014-06-25,2014-12-26,Gonzo,Comedy,1181
30420,Dr. Slump: Arale-chan no Koutsuu Anzen,,Special,Manga,2,Finished Airing,False,G - All Ages,5.77,11066,287,14146,2,1007,"The gang goes on a picknick Sunday morning. Arale almost gets run over when she crosses the street without looking. Senbei makes a rice machine that brings pictures to life, one of which is a bicycle. Tarou and Akane get in trouble for their reckless riding. The next day, everyone goes to school and Tarou doesn't abide to his lessons from the previous day and crashes into a truck when he speeds at an intersection.",,1983,1983-01-01,,Toei Animation,Comedy;Sci-Fi,1182
6355,Marie & Gali Episode Zero,,Special,Original,1,Finished Airing,False,PG - Children,5.76,11094,708,12534,0,1586,This episode aired prior to the original series and introduces the main characters.,,2008,2008-11-08,,Toei Animation,Comedy,1183
30648,Stitch!: Zutto Saikou no Tomodachi Special,Stitch: Heroes are Hard,Special,Other,1,Finished Airing,False,PG - Children,5.75,11114,281,14312,1,959,Ace appears to save the day and Stitch decides to help him.,,2011,2011-06-19,,Shin-Ei Animation,Adventure;Comedy,1184
10701,Ulysses 31 Pilot,,Special,Unknown,1,Finished Airing,False,G - All Ages,5.75,11120,288,14936,1,806,Unaired pilot episode for the TV series.,,1980,1980-01-01,,TMS Entertainment,Action;Adventure;Sci-Fi,1185
33105,"Wake Up, Girl Zoo! Miyagi PR de Go!",,Special,Original,1,Finished Airing,False,G - All Ages,5.75,11120,497,12839,0,1443,,,2016,2016-02-11,,Ordet;W-Toon Studio,Comedy,1186
38291,Bobunemimimmi Specials,Bobunemimimmi Collection,Special,4-koma manga,2,Finished Airing,False,PG-13 - Teens 13 or older,5.75,11123,906,10420,5,3053,"The official website for the Pop Team Epic anime announced on Monday that the series' Bobunemimimmi (Bob Epic Team) segments will be compiled into a standalone Blu-ray Disc release. The release will include all 22 previously released segments by the production team AC-bu, plus two new segments, a ""high speed kamishibai (paper theater) collection"" of the ""Hellshake Yano"" segment, and original stickers.

(Source: ANN)",,2018,2018-09-15,,,Avant Garde;Comedy,1187
8180,Koisuru Tenshi Angelique: Chibi Character Adventure 2,Loving Angel Angelique Chibi Adventure Special 2,Special,Visual novel,1,Finished Airing,False,G - All Ages,5.75,11137,220,14538,1,902,"Another animated short from the Angelique series, this time featuring the Holy Beast Guardians! This just looks like a whole lot of random insanity, which turns out to be just a dream.

(Source: Dailymotion)",,2007,2007-04-25,,,Adventure;Comedy,1188
23825,Ys IV: The Dawn of Ys,,Special,Game,1,Finished Airing,False,PG-13 - Teens 13 or older,5.74,11172,398,14098,2,1018,"This was an animated promotional video that Falcom commissioned for Ys IV: The Dawn of Ys game for PC Engine, to shop around to various production houses. This was done in hopes of getting it made into a full-scale animated series/movie/etc., but it never panned out.

(Source: You Tube)",,1993,1993-01-01,,,Action;Adventure;Fantasy,1189
20667,Zeonic Front: Kidou Senshi Gundam 0079 - Zeon no Hifun,Mobile Suit Gundam: Zeonic Front - Indignation of Zeon.,Special,Original,1,Finished Airing,False,PG-13 - Teens 13 or older,5.74,11173,737,11042,0,2538,"Short animated recap of the One Year War from the perspective of LCDR. Garret Schmitzer. 

Included on the game disc of the Mobile Suit Gundam: Zeonic Front, a PS2 game by BANDAI.",,2001,2001-09-06,,Sunrise,,1190
45605,Bear Bear Bear Kuma! Kumadam-hen,,Special,Light novel,3,Finished Airing,False,PG-13 - Teens 13 or older,5.74,11178,536,11990,1,1907,Bonus episodes of the Bear Bear Bear Kuma! shorts released on the Blu-rays/DVDs for Kuma Kuma Kuma Bear.,,2021,2021-01-27,2021-03-24,EMT Squared,Comedy,1191
10435,Boyfriend,,Special,Manga,1,Finished Airing,False,PG-13 - Teens 13 or older,5.73,11202,339,13290,1,1268,"Takatou Masaki is the second youngest of four sons, and seemingly a delinquent by nature. His hot temper has put a wedge between himself and his strict father, gotten him kicked out of one school, and tossed him at a school notoriously horrible for the one thing he's truly good at, basketball. A chance encounter with the willful Yuuki Kanako may serve as a catalyst for change, as the indefinable connection she feels with him draws them together... 

(Source: Storm in Heaven)",,1992,1992-02-11,,Magic Bus,Romance;Sports,1192
24975,Ghibli ga Ippai Special Short Short,,Special,Other,10,Finished Airing,False,G - All Ages,5.73,11206,721,10838,2,2692,A DVD release with a collection of commercials and TV spots produced by Studio Ghibli or its subsidiary Studio Kajino between the years 2000 and 2005.,,2005,2005-11-16,,Studio Ghibli,Slice of Life,1193
34878,Dr. Slump: Arale-chan - Penguin Mura no Shouboutai,,Special,Manga,1,Finished Airing,False,PG-13 - Teens 13 or older,5.73,11206,249,14698,0,865,The cast of Dr. Slump: Arale-chan help promote fire safety.,,1984,1984-01-01,,,Comedy;Sci-Fi,1194
22031,Samurai Gun Special,,Special,Manga,1,Finished Airing,False,R - 17+ (violence & profanity),5.73,11228,346,13765,0,1114,"Unaired episode 8.5 of Samurai Gun. Ichimatsu goes on a mission to replace the enemy's keybook with a fake one, while Ohana gets kidnapped.",,2005,2005-06-29,,Studio Egg,Action,1195
25889,Stitch!: Itazura Alien no Daibouken - Uchuu Ichi no Oniichan,Stitch: Son of Sprout,Special,Other,1,Finished Airing,False,G - All Ages,5.73,11229,290,14148,1,1007,"An exclusive episode showing the guest character, Kijimunaa's sister, who looks like Kijimunaa and is pink. 

(Source: Wikipedia)",,2010,2010-08-08,,Madhouse,Adventure;Comedy;Sci-Fi,1196
37082,Uchuu Senkan Yamato Pilot Film,,Special,Original,1,Finished Airing,False,PG-13 - Teens 13 or older,5.73,11234,418,12820,0,1450,The pilot film to Uchuu Senkan Yamato. It was created in August 1974 for Yomiuri Television executives but released to the public 16 years later on the Uchuu Senkan Yamato LD Box Set. The pilot was included on later releases for DVD/BD but they lack certain sounds/audio due to a copyright issue that came about in the time between the LD and DVD/BD releases.,,1990,1990-07-27,,,Sci-Fi,1197
38667,W'z: Hand Shakers with W'z,,Special,Original,1,Finished Airing,False,PG-13 - Teens 13 or older,5.73,11235,934,10350,0,3111,,,2019,2019-02-27,,GoHands,Action,1198
8963,Stitch!: Piko Kara no Chousenjou,Stitch vs. Penny,Special,Other,1,Finished Airing,False,PG - Children,5.72,11244,477,12846,0,1439,"A special episode of Stitch, taking place between season 1 and season 2.",,2009,2009-06-26,,Madhouse,Adventure;Comedy,1199
9591,Code Geass: Hangyaku no Lelouch R2 Omake Flash,Code Geass: Lelouch of the Rebellion R2 Extra Flash - Baba Theater Redux,Special,Original,9,Finished Airing,False,PG-13 - Teens 13 or older,5.72,11256,5863,5377,16,17523,9 flash anime specials included in the Code Geass R2 DVDs and BDs.,,2008,2008-08-22,2009-04-24,Sunrise,Comedy,1200
55324,Devilman Pilot Film,,Special,Manga,1,Finished Airing,False,R - 17+ (violence & profanity),5.72,11258,137,17589,0,438,Unaired pilot film released for the first time in the Blu-ray box release.,,2015,2015-10-07,,Toei Animation,Action;Horror;Supernatural,1201
5472,Kokoro Toshokan: Communication Clips,,Special,Manga,1,Finished Airing,False,G - All Ages,5.72,11274,342,14441,0,925,"A small collection of various clips from throughout the series, separted by 3 second segments with titles like ""Kokoro's Cute"" coupled with a quick clip of some mech anime.

(Source: ANN)",,2002,2002-01-01,,,Comedy;Drama;Slice of Life,1202
19279,Pony Metal U-GAIM Promotion Film,,Special,Original,1,Finished Airing,False,G - All Ages,5.72,11284,573,13199,2,1303,"This is a short little pilot film inserting Yuu Morisawa, the heroine of Creamy Mami, into the mecha world of Heavy Metal L-Gaim. 

After Yuu Morisawa is killed in a car accident, she is rebuilt as Pony Metal U-GAIM in a scenario à la Astroboy. Put to a high-energy Japanese pop song, this experimental mishmash of genres was the brainchild of studio Anime R. 

The series was never made for copyright reasons, and this pilot film is all that remains alongside a handful of merchandise.",,1986,1986-01-01,,,Action;Sci-Fi,1203
34476,Platonic Chain: Ansatsu Jikkouchuu,,Special,Novel,1,Finished Airing,False,PG-13 - Teens 13 or older,5.72,11285,133,15881,1,623,"A DVD-only story that replaces episode 16 (""Oyaji Camera"") of the TV series. There is a system where anyone can submit a picture of a person that annoys them for 100 yen. When a million photos of the same person are collected, a killer is hired for the resulting 100.000.000 yen.",,2005,2005-07-25,,ACiD FiLM,Sci-Fi;Slice of Life,1204
37934,Mahou Shoujo Lyrical Nanoha StrikerS Picture Drama,,Special,Original,1,Finished Airing,False,G - All Ages,5.71,11290,291,12825,1,1446,"A picture drama released on the BD Box Set of Mahou Shoujo Lyrical Nanoha StrikerS. Subaru, Teana, Vivio host a radio show promoting their own BD Box Sets. They look at a hypothetical Midchilda Academy with all the core cast is present be it as students or as teachers.",,2015,2015-02-25,,,Comedy,1205
18729,Marginal Prince: Gekkeiju no Ouji-tachi - Tokyo Merry-Go-Round,,Special,Visual novel,1,Finished Airing,False,PG-13 - Teens 13 or older,5.71,11293,565,10885,1,2655,"Keita and the other Marginal Prince are away from St. Alphonso Academy and meet each other in the city, where they meet Keita's sister.

Extra episode released with the 7th DVD volume.",,2007,2007-07-19,,Tokyo Kids,Boys Love,1206
22137,Toukiden: The Age of Demons - Introduction,,Special,Game,1,Finished Airing,False,PG-13 - Teens 13 or older,5.71,11309,452,13273,0,1273,"Two siblings are running away from demons which attacked their village. Just when they are cornered, a mysterious female fighter appears and slays the demons. This female fighter turns out to be a Slayer, a demon that fights other demons and is part of a village of Slayers.",,2013,2013-06-26,,Studio 4°C,Action,1207
7248,Top wo Nerae! Gunbuster Specials,Gunbuster Renewal EX,Special,Original,3,Finished Airing,False,PG-13 - Teens 13 or older,5.71,11310,2735,7651,1,7222,A series of Gunbuster shorts included in the DVD release.,,2000,2000-11-25,2001-03-25,Gainax,Action;Sci-Fi,1208
37000,Bernard-jou Iwaku.: Ofuro Dokusho,,Special,Manga,1,Finished Airing,False,PG-13 - Teens 13 or older,5.71,11323,781,12091,0,1851,Special episode included with BD/DVD release.,,2017,2017-01-20,,Creators in Pack,Comedy,1209
32410,Dimension W: W no Tobira Online - Rose no Onayami Soudanshitsu,Dimension W: W Gate Online - Rose's Counseling Room,Special,Manga,5,Finished Airing,False,G - All Ages,5.71,11330,3133,6267,8,11805,Short specials included in the Blu-ray releases of Dimension W.,,2016,2016-03-25,2016-08-26,Studio 3Hz,Sci-Fi,1210
34336,Glass no Kamen desu ga to Z Specials,,Special,Manga,2,Finished Airing,False,PG-13 - Teens 13 or older,5.71,11333,111,16965,0,495,Two unaired episodes of Glass no Kamen desu ga to Z released in various combinations of the parody franchises' DVD/BD release.,,2013,2013-09-04,,,Comedy,1211
22985,Hipira-kun Special,,Special,Picture book,1,Finished Airing,False,PG - Children,5.71,11335,360,14569,0,896,Last episode of Hipira-kun bundled with the DVD/Blu-ray release.,,2014,2014-01-29,,Sunrise,Comedy;Fantasy;Supernatural,1212
36756,91 Daze,,Special,Original,7,Finished Airing,False,PG-13 - Teens 13 or older,5.7,11338,2399,8402,6,5777,"91 Daze is a series of shorts included in various disk packages. They focus around Angelo, Nero, and sometimes Corteo in various comedic situations.

(Source: 91-days.wikia)",,2016,2016-11-30,2017-07-05,Shuka,Comedy,1213
37663,God Eater Reso Nantoka Gekijou: Nagerareta Shokupan,,Special,Game,1,Finished Airing,False,G - All Ages,5.7,11351,1024,8267,2,5980,"Short anime inspired by the iOS and Android mobile game God Eater Resonant Ops.

Introduces the characters through their first day of school. Resonant Ops continues the story of God Eater 2 Rage Burst, which in turn is a sequel to God Eater Burst, and is set 4 years after the latter's story, moving the setting ""at long last"" toward the Fenrir Headquarters in the year 2078.",,2018,2018-03-24,,Passione;Creators in Pack,Fantasy;Sci-Fi,1214
32898,Kidou Senshi Gundam 0083: Stardust Memory Picture Drama - Uchuu no Kagerou 2,Mobile Suit Gundam 0083: Stardust Memory Picture Drama - The Mayfly of Space 2,Special,Other,1,Finished Airing,False,PG-13 - Teens 13 or older,5.7,11361,1150,10223,0,3222,"Picture drama included in the Blu-ray release of 0083.

Universal Century 0083. Inside the Zanzibar-class mobile cruiser Lili Marleen, Cima Garahau, the former Zeon M.A.U. (Marine Amphibious Unit) Commander, was battling her recurring nightmare of being abandoned by Zeon military during One Year War and drifting in Space in the past 4 years. This picture drama also recounts Cima's past and present encounter with Anavel Gato, as well as introducing a new character, the Zeon fugitive Geil Hunt.

(Source: Gundam Wiki)",,2016,2016-01-29,,Sunrise,Action;Sci-Fi,1215
50662,Keroro Gunsou x No More Eiga Dorobou,"""Stop! Piracy"" Sgt. Frog x No More Movie Thief",Special,Manga,1,Finished Airing,False,G - All Ages,5.7,11361,141,17745,0,426,"As the fourth in a series of activities to promote and raise awareness of the Manga-Anime Guardians Project (MAGP), a new ""Stop! Piracy"" clip featuring the characters from the Sgt. Frog anime franchise has been produced. In Japan, the anti-piracy video series featuring a camera-headed character named ""Eiga Dorobou"" (Movie Thief) is shown before every movie screening. In this clip, Eiga Dorobou performs with Keroro, who is trying to access pirated anime and manga without knowing its illegality, along with his friends.

MAGP was launched in July 2013 in order for manga publishers and animation-related companies to cross-sectionally share information on piracy in Japan and abroad, investigate the actual situation, and take countermeasures. This new ""Stop! Piracy"" video was produced to inform the public that the illegal downloading of infringing content, which was previously limited to movies and music works, now covers all copyrighted works due to the revised Copyright Act, which came into effect on January 1, 2021. The clip will be screened in 75 theaters in the Kanto area from December 24. 

(Source: Crunchyroll)",,2021,2021-12-24,,,Comedy,1216
24789,Shoko Nakagawa Prism Tour Special,,Special,Original,1,Finished Airing,False,G - All Ages,5.7,11369,188,15537,0,678,A Sunrise-produced special created for Shoko Nakagawa's 2010 Prism Tour.,,2010,2010-04-01,,Sunrise,,1217
26447,Uchuusen Sagittarius Pilot,,Special,Original,1,Finished Airing,False,G - All Ages,5.7,11375,176,17827,0,421,"The pilot episode made for Uchuusen Sagittarius. Features the original comic book art and no voice acting.

(Source: Wikipedia)",,1982,1982-01-01,,,Adventure;Sci-Fi,1218
21009,Sekai de Ichiban Tsuyoku Naritai! Specials,Wanna Be the Strongest in the World Specials,Special,Manga,6,Finished Airing,False,R+ - Mild Nudity,5.69,11383,3439,7006,5,9039,"Short specials included on the BD/DVD volumes of ""Sekai de Ichiban Tsuyoku Naritai!""",,2013,2013-12-12,2014-05-12,Arms,Sports;Ecchi,1219
25441,Shin Strange+ Special,,Special,Manga,1,Finished Airing,False,PG-13 - Teens 13 or older,5.69,11384,485,11605,0,2146,Unaired episode included with the Blu-ray/DVD release.,,2014,2014-10-19,,Seven,Comedy,1220
24123,Kaette Kita Top wo Nerae! Kagaku Kouza,,Special,Original,2,Finished Airing,False,G - All Ages,5.69,11413,990,10859,4,2679,"Extra science lessons included with the Gunbuster Blu-ray Box Complete Edition. These explain how the space ropeway works, and time dilation from near-lightspeed travel.",,2012,2012-02-24,,Gainax,Comedy;Sci-Fi,1221
8231,Princess Lover!: Magical Knight Maria-chan,,Special,Visual novel,6,Finished Airing,False,PG-13 - Teens 13 or older,5.69,11430,4091,6447,2,11028,"Promo-like shorts, featuring Maria as a magical knight.",,2009,2009-10-23,2010-03-25,GoHands,,1222
31643,Mr. Deniroo in Henteko Mushi,Mr. Deniroo in Henteko Mushi,Special,Original,1,Finished Airing,False,G - All Ages,5.68,11448,124,19317,1,314,,,2006,2006-01-01,,,Comedy;Slice of Life,1223
31638,Mr. Shape,,Special,Original,4,Finished Airing,False,G - All Ages,5.68,11449,108,20127,0,268,Follows characters made of particular shapes.,,2009,2009-01-01,2017-12-11,,Comedy,1224
21771,Romantica Clock,,Special,Manga,3,Finished Airing,False,G - All Ages,5.68,11456,6802,5920,11,13687,"Three episodes aired on TV as part of the Ribon x Oha Suta specials. 

Akane: She's beautiful and popular, lively and full of vitality; Aoi: Looks like a small animal but is actually very clever. Who knew that these two very different people were actually... twin siblings?! 

(Source: MU) 

Note: Episodes were made available on the official stream few days before the official broadcast.",,2014,2014-02-04,2014-02-25,,,1225
17209,Suzy's Zoo: Daisuki! Witzy - Happy Birthday,,Special,Original,1,Finished Airing,False,G - All Ages,5.68,11461,190,17386,1,454,This special is a short story about Witzy and the surprise birthday party that is planned by his friends.,,2011,2011-12-02,,Digital Media Lab,,1226
26079,Donyatsu Specials,,Special,Manga,2,Finished Airing,False,G - All Ages,5.68,11475,257,15078,0,769,DVD specials of the Donyatsu series.,,2013,2013-12-20,,Gathering,Comedy;Sci-Fi,1227
36163,Aoi Triton,,Special,Manga,1,Finished Airing,False,G - All Ages,5.67,11487,145,17872,0,417,"Pilot movie of Umi no Triton, it was created in October 1971 for the intention of selling the series to international markets and features a more Western-style drawn Triton. The pilot was released to the public on the Umi no Triton: Original Gekijou-ban DVD release nearly 3 decades later.",,2002,2002-03-22,,Mushi Production,Fantasy,1228
14067,Ginga Hyouryuu Vifam: Chicago Super Police 13,,Special,Original,1,Finished Airing,False,PG - Children,5.67,11494,187,15939,0,614,A parody of Ginga Hyouryuu Vifam set in 1920's Chicago. Originally released as an extra on the Ginga Hyouryuu Vifam: Keito no Kioku - Namida no Dakkai Sakusen VHS tape.,,1985,1985-09-25,,,Action;Comedy,1229
38789,One Room: Second Season Special,,Special,Original,1,Finished Airing,False,PG-13 - Teens 13 or older,5.67,11512,4361,6497,5,10842,One Room 2nd Season  special included on the BD release of the main show. It follows bedroom 'role play' scenarios you have with the girls and dream scenarios you have while asleep near the girls.,,2018,2018-11-30,,Zero-G,Ecchi,1230
44588,The Gregory Gallery Tour Special,,Special,Original,3,Finished Airing,False,PG-13 - Teens 13 or older,5.67,11518,197,16514,0,542,"Three unbroadcasted exclusive Special shorts of Gregory Horror Show (presented as bonus videos on the first series DVDs volumes 1-3 in Japan only), containing stories featuring Gregory himself as a guide, giving his commentary and thoughts on each of the guests in the hotel, also displaying paintings based around the said guests.

(Source: Wikipedia)",,2000,2000-03-03,2000-06-21,Milky Cartoon,Comedy;Horror;Mystery;Supernatural,1231
28775,White Fantasy,WHITE FANTASY,Special,Other,1,Finished Airing,False,G - All Ages,5.67,11519,773,12374,1,1672,"Animated short for K-Swiss Asia, a subsidiary of American footwear company K-Swiss.",,2014,2014-12-05,,,Fantasy;Sports,1232
41075,Code Geass: Hangyaku no Lelouch DVD Magazine Picture Drama,Code Geass: Lelouch of the Rebellion DVD Magazine Picture Drama,Special,Original,8,Finished Airing,False,PG-13 - Teens 13 or older,5.66,11538,928,10298,1,3152,"Short episodes included in the ""Code Geass DVD Magazine.""",,2007,2007-12-21,2008-01-25,,Comedy,1233
5501,Gun x Sword-san,,Special,Unknown,13,Finished Airing,False,PG-13 - Teens 13 or older,5.66,11543,1130,10096,0,3359,"These are a series of 13 omake episodes of Gun x Sword, tied in very loosely to the plot, with the characters as chibi puppets. The main characters are Wendy and her turtle, Kameo, who is the size of a human in this series and is able to talk. All the episodes seem to center around analyzing various events in Gun x Sword and mocking the themes displayed.

They are included on the DVDs.

(Source: Wikipedia)",,2005,2005-10-21,2006-10-25,AIC ASTA,Action;Avant Garde,1234
19479,Monkey Punch: Manga Katsudou Daishashin - Crime Mate Special,,Special,Manga,1,Finished Airing,False,R - 17+ (violence & profanity),5.65,11560,238,14405,0,935,"Miki and Naomi are a pair of assassins who are also friends known as Crime Mate. While Miki is pole dancing for Chinese mafia boss Ramon who deals with biological arms, Naomi warns her about an armed group of ninjas. After Miki deals with Ramon's gang and Naomi takes out the ninjas, the next day Miki sees the deceased body of Ricardo Gonzalez in her bed who offers Crime Mate a million dollars for the job. Naomi then gets kidnapped by Ramon so it is up to Miki to save her as they try to deal with Ramon. Also why is a King Cobra after them?

Some characters from Mankatsu as well as the 4 central characters from Lupin III can be seen in the background at times.

(Source: Lupin III Wiki)",,2005,2005-09-14,,TMS Entertainment,Action;Comedy;Ecchi,1235
31493,Lord of Vermilion III Special Anime Movie,,Special,Game,1,Finished Airing,False,PG-13 - Teens 13 or older,5.65,11561,325,12657,3,1530,A short special that features characters from the arcade game Lord of Vermilion III engaged in battle.,,2015,2015-08-22,,Seven Arcs Pictures,Action;Adventure;Fantasy,1236
22241,Ribbon no Kishi Pilot,,Special,Unknown,1,Finished Airing,False,G - All Ages,5.65,11571,209,15237,0,735,Unaired pilot episode of Ribbon no Kishi.,,1966,1966-11-28,,Mushi Production,Adventure,1237
37124,THE iDOLM@STER Cinderella Girls: Starlight Stage - Shinshun! Happy New Year Campaign,,Special,Game,1,Finished Airing,False,G - All Ages,5.65,11575,356,13052,2,1350,A televised New Years commercial promoting the THE iDOLM@STER: Cinderella Girls - Starlight Stage (iOS/Android game) campaign starting the following day where you can receive 10 consecutive gifts in the gacha draw. The commercial opens with the girls listing off the best things to do for New Years.,,2017,2017-12-31,,,,1238
