id,title,title_english,type,source,episodes,status,airing,rating,score,rank,scored_by,popularity,favorites,members,synopsis,season,year,start,ending,studios,genres,ranking
3138,"Solty Rei: Surechigau Kimochi de, Omoi Au Kokoro de.",,Special,Original,1,Finished Airing,False,PG-13 - Teens 13 or older,7.01,4323,1890,9344,4,4284,"This is a two part story that happened after Rose moved in to Roy's apartment. During the preparations for Appreciation Day, Solty watches people in the city going about and preparing for the celebration and is confronted with a thought: what is true happiness? While trying to understand happiness and the complexity of human emotions, a young girl who has had a falling out with her mother confronts Solty and Rose asking for their help. ""Love Shared"" is actually the second half of ""Opportunities Missed"", while ""Opportunities Missed"" shows the entire story.

(Source: Wikipedia)",,2006,2006-07-26,,Gonzo;AIC,Comedy;Drama,318
12709,Tales of Symphonia The Animation: Sekai Tougou-hen Specials,,Special,Game,3,Finished Airing,False,G - All Ages,7.01,4326,2298,7932,3,6655,Specials that came with the DVDs of Sekai Tougou Hen.,,2011,2011-11-23,2012-10-24,ufotable,Comedy,319
36798,Yuuki Yuuna wa Yuusha de Aru: Hidamari,Yuki Yuna is a Hero: A Sunny Place,Special,Original,1,Finished Airing,False,PG-13 - Teens 13 or older,7.01,4335,3984,6772,9,9855,A recap episode of the original series made to connect Yuuki Yuuna wa Yuusha de Aru: Washio Sumi no Shou to the sequel series Yuuki Yuuna wa Yuusha de Aru: Yuusha no Shou.,,2017,2017-11-18,,Studio Gokumi,Drama,320
18343,Girls & Panzer: Fushou Akiyama Yukari no Sensha Kouza,,Special,Original,6,Finished Airing,False,PG-13 - Teens 13 or older,7.01,4350,5553,5914,13,13734,Girls &amp; Panzer specials with Yukari Akiyama explaining the background of tank units that appear in the series.,,2012,2012-12-21,2013-06-21,Actas,,321
12823,Shakugan no Shana-tan III (Final): Final Destruction,,Special,Unknown,2,Finished Airing,False,PG-13 - Teens 13 or older,7.0,4383,7207,5112,13,19961,Shakugan no Shana-tan: Final Destruction specials bundled with the limited edition second and sixth volumes of the Shakugan no Shana III (Final) Blu-ray and DVD.,,2012,2012-01-27,2012-05-30,J.C.Staff,Comedy,322
30641,Yankee-kun na Yamada-kun to Megane-chan to Majo,,Special,Manga,1,Finished Airing,False,PG-13 - Teens 13 or older,7.0,4393,10034,4472,11,27360,"The official website for the Yamada-kun and the Seven Witches television anime series revealed on Sunday that the anime's first Blu-ray Disc and DVD box sets will include a Yankee-kun to Megane-chan collaborative manga and anime. 

(Source: ANN)",,2015,2015-08-26,,LIDENFILMS,Comedy,323
5196,Aria the Origination Picture Drama,Aria The Origination Picture Drama,Special,Manga,7,Finished Airing,False,G - All Ages,7.0,4394,5211,6218,15,12018,"The path to becoming a Prima Undine—a guide who can lead tours on her gondola—-is long and arduous, but that does not mean there is no time to enjoy the pleasures Neo-Venezia has to offer! For Akari Mizunashi and her Undine companions, Aika S. Granzchesta and Alice Carroll, participating in various fun activities provides much-needed downtime from their intense Prima Undine training. Joined by friends whom they have met throughout their journey, the girls make unforgettable memories that shine brighter for being in the city of miracles.

[Written by MAL Rewrite]",,2008,2008-04-25,2008-10-25,HAL Film Maker,Fantasy;Sci-Fi;Slice of Life,324
34644,Brave Witches: Petersburg Daisenryaku,Brave Witches: Petersburg Grand Strategy,Special,Original,1,Finished Airing,False,R+ - Mild Nudity,7.0,4396,3958,6381,15,11298,"As New Year’s Eve draws closer, preparations for a holiday party are underway in Petersburg. In anticipation of the event, Eila Ilmatar Juutilainen of the 501st Joint Fighter Wing is determined to take Sanya V. Litvyak on a leisurely walk around the city. However, despite Eila's best intentions, she gets interrupted every time she gets a chance to ask Sanya out, ruining the moment and separating the girls. To make things worse, a Neuroi is approaching the base, threatening both the squadmates and the celebration in Petersburg.

[Written by MAL Rewrite]",,2017,2017-08-25,,SILVER LINK.,Action;Sci-Fi;Ecchi,325
30825,Gakkou no Kaidan: Kubinashi Rider!! Shi no Noroi,Ghost Stories: The Headless Horsemen!! Curse of Death,Special,Novel,1,Finished Airing,False,PG-13 - Teens 13 or older,6.99,4409,10129,5426,10,17119,"A TV special of Gakkou no Kaidan that aired almost 5 months after the original anime. However, this event takes place before the Finale episode of the TV series.

The story focuses on a headless motorcycle rider.",,2001,2001-08-24,,Pierrot,Horror;Mystery;Supernatural,326
37814,Inazuma Eleven: Reloaded - Soccer no Henkaku,,Special,Game,1,Finished Airing,False,G - All Ages,6.99,4413,3627,7511,7,7554,"Special prologue episode of the Inazuma Eleven: Ares no Tenbin series. It is a remake of the original Inazuma Eleven episode 27.

After defeating Zeus and becoming the Football Frontier champions, the members of Raimon return to the soccer club. Unlike episode 27, the club is not invaded by aliens. Instead, everyone congratulates the team members for their remarkable achievements.

Kidou Yuuto and Gouenji Shuuya then propose to take on the world. Hibiki Seigou comes in and, incidentially, proposes a match between Raimon and the Spanish youth league champion, Barcelona Orb.

(Source: Inazuma Eleven Wiki)",,2018,2018-01-21,,OLM,Sports,327
5691,Rekka no Honoo: Final Burning,Flame of Recca: Final Burning,Special,Manga,1,Finished Airing,False,PG-13 - Teens 13 or older,6.99,4429,2689,7594,8,7351,"This episode explains why the title of the series is ""Flame of Recca"". The things that happened in this short OAV was in the last volume, volume 33, of the tankoubon of Flame of Recca.",,2004,2004-06-10,,Pierrot,Action;Adventure;Sci-Fi,328
17391,Senyuu. Specials,,Special,Web manga,4,Finished Airing,False,PG-13 - Teens 13 or older,6.99,4432,9699,5288,9,18385,"Unaired episodes of Senyuu. released with BD/DVD volumes.

1. Yuusha, Nagurareru. / Nise Panda no Seitai (Vol. 1)
2. Shitsujichou no Tabi Sono 1 (Vol. 2)
3. Shitsujichou no Tabi Sono 2 (Vol. 3)
4. Gakuen Senyuu.: Seishun Monogatari (Vol. 4)",,2013,2013-04-24,2013-11-22,Ordet;LIDENFILMS,Action;Comedy;Fantasy,329
32034,Soukyuu no Fafner: Dead Aggressor - Exodus Special,,Special,Original,1,Finished Airing,False,PG-13 - Teens 13 or older,6.98,4439,545,11527,2,2199,An expanded version of the first episode of Soukyuu no Fafner: Dead Aggressor - Exodus included in the Blu-ray &amp; DVD Vol.1.,,2015,2015-02-04,,I.Gzwei,Action;Drama;Sci-Fi,330
3354,Zombie-Loan Specials,Zombie-Loan,Special,Manga,2,Finished Airing,False,PG-13 - Teens 13 or older,6.98,4449,15363,4305,18,29436,The series was originally planned to be 20+ episodes but was cut short due to unknown circumstances. These specials released on the 7th DVD volume continue the story.,,2008,2008-04-25,,XEBEC M2,Action;Horror;Supernatural,331
7261,Mameshiba,,Special,Original,24,Finished Airing,False,G - All Ages,6.98,4470,2851,8439,22,5727,"In these short animated clips, little dog-faced talking beans appear in people's food and inform them about different facts.",,2008,2008-03-01,2013-01-01,,Comedy,332
2298,Kidou Senshi Gundam SEED: Hoshi no Hazama de,Mobile Suit Gundam SEED: After-Phase Between the Stars,Special,Original,1,Finished Airing,False,PG-13 - Teens 13 or older,6.97,4484,8578,5445,7,16978,"As the war between ZAFT's Coordinators and Earth's Naturals comes to a close, the survivors of the conflict recuperate. Some of these veterans heal with the aid of loved ones, and others choose to recover in isolation, reflecting on their losses and the friends no longer with them.

In this epilogue to the hardships of Kira Yamato and Athrun Zala, the heroes come to terms with their roles in the recent war and prepare for adventures yet to come.

[Written by MAL Rewrite]",,2004,2004-03-26,,Sunrise,Action;Drama;Sci-Fi,333
36692,Senki Zesshou Symphogear AXZ: Senki Zesshou Shinai Symphogear,,Special,Original,4,Finished Airing,False,PG-13 - Teens 13 or older,6.97,4503,1940,8480,5,5659,Original short episodes featuring characters in super-deformed style. Bundled with Blu-ray/DVD volumes 3 to 6 of the anime.,,2017,2017-11-29,2018-02-28,Satelight,Comedy;Sci-Fi;Slice of Life,334
834,Bleach: The Sealed Sword Frenzy,,Special,Manga,1,Finished Airing,False,PG-13 - Teens 13 or older,6.97,4513,65415,1924,156,120772,A Shinigami named Baishin who was sealed by Soul Society long ago is set free on Earth. On a fateful day Ichigo encounters him and has roughly half of his reiatsu drained. Its now up to Ichigo and the Soul Society to finally put a stop to Baishin and his destruction.,,2006,2006-03-23,,Pierrot,Action;Adventure;Supernatural,335
23361,Bakuman. 3rd Season Specials,,Special,Manga,2,Finished Airing,False,PG-13 - Teens 13 or older,6.96,4528,6304,5392,19,17404,"Rakko Umi e Kaeru!
Among the world's most powerful otters is Rakko 9-gou, the abandoned and forgotten ""Lost Number"" who seeks vengeance on the human race. Rakko 11-gou attempts to foil the plans of his adversary, but his ""Olivine Tholeiite"" attack has no effect on Rakko 11-gou's tail of carbon nanotubes! Can Rie and Naho make it in time to save Rakko 11-gou?

Reversi PV
This is the vigorous theme song that begins each episode of Reversi, a gripping anime about Schwarz, a demon of darkness; and Weiss, a demon of light.

[Written by MAL Rewrite]",,2013,2013-06-26,2013-08-28,J.C.Staff,Comedy,336
4071,Black Jack (TV): Hizouban Specials,,Special,Manga,2,Finished Airing,False,G - All Ages,6.96,4530,1106,10115,1,3345,"This was originally from the Black Jack (2004), but weren't aired then, only later. There are two episodes in this:
The Dog Thief
Kamaitachi in the Woodlands",,2006,2006-07-17,,Tezuka Productions,Adventure,337
596,Chobits: Chibits,Chobits: Chibits - Sumomo and Kotoko Deliver,Special,Manga,1,Finished Airing,False,PG-13 - Teens 13 or older,6.96,4531,27199,3366,62,47727,"When Hideki Motosuwa leaves his apartment and accidentally forgets his wallet, Chii takes the wallet and follows him, leaving Sumomo and Kotoko alone in the apartment. It doesn’t take long time until Sumomo discovers that Chii forgot her panties, so Sumomo and Kotoko sets out on an adventurous trip to return the panties to Chii.

(Source: ANN)",,2003,2003-06-27,,Madhouse,Comedy;Romance,338
31138,Overlord: Ple Ple Pleiades,,Special,Light novel,8,Finished Airing,False,PG-13 - Teens 13 or older,6.96,4552,45245,2465,68,83667,Specials bundled with the Blu-ray and DVD volumes of Overlord featuring simplified character animations.,,2015,2015-09-25,2016-02-24,Studio PuYUKAI,Action;Comedy;Fantasy,339
6941,Toriko: Jump Super Anime Tour 2009 Special,,Special,Manga,1,Finished Airing,False,PG-13 - Teens 13 or older,6.96,4556,3958,7178,9,8559,"Special shown at the Jump Super Anime Tour in 2009.

In a world where the taste and texture of food is extremely important, there exist individuals known as Bishoku-ya (luxury food providers) who specialize in the acquisition of rare ingredients and animals. Toriko is one of these hunters and it is his dream to find the most precious foods in the world and create the ultimate dinner course. As one of the most skilled hunters in the world he is regularly hired by restaurants and the rich to seek out new ingredients and rare animals.

A man with inhuman ability, he utilizes his incredible strength and knowledge of the animal kingdom to capture ferocious, evasive and rare beasts to further his final goal, the ultimate dinner course composed of the most delicious food in the world. He is currently accompanied by a weak and timid chef who, inspired by Toriko's ambition, travels with him to improve his culinary skills and find rare ingredients.",,2009,2009-10-12,,ufotable,Action;Adventure;Comedy;Gourmet,340
32151,Senki Zesshou Symphogear GX: Senki Zesshou Shinai Symphogear,,Special,Original,4,Finished Airing,False,PG-13 - Teens 13 or older,6.95,4564,2845,7537,6,7487,Original short episodes featuring characters in super-deformed style.,,2015,2015-11-25,2016-02-24,Satelight,Comedy;Sci-Fi;Slice of Life,341
6312,Taiho Shichau zo: Full Throttle - Watashitachi no Iru Basho,You're Under Arrest: Full Throttle Special,Special,Manga,1,Finished Airing,False,PG-13 - Teens 13 or older,6.95,4569,1313,9700,1,3829,"Rounding off season 3, Natsumi and Miyuki reminiscince about their lives at Bokuto station while hearing from people they've met through work. (This is limited to characters they've met in season 3.)

We are also introduced to Bokuto Station's two new recruits; Kaori Takano and Sakura Fujieda. Starting off their duty, they are taken on a field trip by Miyuki and Natsumi and quickly find out what will be expected of them as police officers.",,2008,2008-08-22,,Studio Deen,Action;Adventure;Comedy,342
10737,A-Channel: +A-Channel,A-Channel: +A-Channel,Special,4-koma manga,11,Finished Airing,False,PG-13 - Teens 13 or older,6.95,4578,9971,5095,11,20135,Extra specials from the DVD/BDs.,,2011,2011-05-25,2011-10-26,Studio Gokumi,Comedy;Slice of Life,343
21853,Love Live! School Idol Project Recap,,Special,Other,1,Finished Airing,False,PG-13 - Teens 13 or older,6.95,4596,3380,6773,13,9851,Narrated recap of the Love Live! School Idol Project series included on the official  Blu-ray fandisc release.,,2013,2013-12-25,,Sunrise,Slice of Life,344
30896,Love Live! School Idol Project: μ's →NEXT LoveLive! 2014 - Endless Parade Encore Animation,,Special,Original,1,Finished Airing,False,PG-13 - Teens 13 or older,6.94,4609,2159,7910,12,6692,"Another short bonus included in a Blu-ray/DVD disc of μ's live concert that took place in Saitama Super Arena on February 8th and 9th, 2014.",,2014,2014-07-23,,Sunrise,Comedy,345
4997,Mahoromatic 2 End Year Special,,Special,Manga,1,Finished Airing,False,R+ - Mild Nudity,6.94,4610,2537,8092,2,6301,Summary of episodes 1 to 12 of Mahoromatic 2.,,2002,2002-12-21,,Gainax,Comedy;Romance;Sci-Fi;Ecchi,346
10775,SKET Dance: Tettei Bunseki Special,,Special,Unknown,1,Finished Airing,False,PG-13 - Teens 13 or older,6.94,4623,1571,8507,3,5614,"Special aired a couple of days before episode 5. It's a mix of explanations, recaps, and a seiyuu interview.",,2011,2011-05-03,,Tatsunoko Production,,347
50916,Arifureta Shokugyou de Sekai Saikyou: Arifureta Yorimichi de Sekai Saikyou,Arifureta: From a Detour to the World's Strongest,Special,Light novel,1,Finished Airing,False,PG-13 - Teens 13 or older,6.94,4634,22352,3273,102,50527,Unaired episode included in the first Blu-ray volume.,,2022,2022-03-23,,asread.;studio MOTHER,Action;Adventure;Fantasy,348
31298,Baka to Test to Shoukanjuu: Matsuri - Sentakushi Ikou nomi,,Special,Light novel,6,Finished Airing,False,PG-13 - Teens 13 or older,6.94,4635,5094,5864,11,14005,Specials included in the Baka to Test to Shoukanjuu: Matsuri BD/DVD volumes featuring alternative endings to the OVA episodes.,,2011,2011-02-23,2011-03-30,SILVER LINK.,Comedy,349
1311,Chobits Recap,Chobits: Hibiya and Kotoko Chat,Special,Manga,1,Finished Airing,False,PG-13 - Teens 13 or older,6.93,4652,20537,3790,41,38601,A DVD recap episode of the Chobits TV series.,,2003,2003-02-21,,Madhouse,Comedy;Drama;Romance;Sci-Fi;Ecchi,350
37103,Danganronpa 3: Monokuma Gekijou,,Special,Visual novel,3,Finished Airing,False,PG-13 - Teens 13 or older,6.93,4655,10244,4192,77,31088,Danganronpa 3 skits included in the Blu-ray Box Sets.,,2016,2016-10-27,2016-12-21,Lerche,Comedy,351
4082,Kaibutsu Oujo: Konsui Oujo,Princess Comatose,Special,Manga,1,Finished Airing,False,PG-13 - Teens 13 or older,6.93,4662,5670,6160,11,12350,Episode 26 included in the ninth DVD volume of Kaibutsu Oujo.,,2008,2008-02-14,,Madhouse,Action;Comedy;Horror;Supernatural,352
1659,Mai-Otome Specials,,Special,Original,9,Finished Airing,False,PG-13 - Teens 13 or older,6.93,4671,2849,8048,3,6385,Specials that followed on the Mai-Otome DVD.,,2006,2006-01-27,2006-09-26,Sunrise,Comedy;Drama;Fantasy,353
5199,Seto no Hanayome Fan Disc,,Special,Manga,2,Finished Airing,False,PG-13 - Teens 13 or older,6.93,4687,2581,7135,3,8651,"Fan discs containing shorts that weren't included in the TV series. 

1. Aoi Koi-hen
2. Ibara Koiji-hen

Each Fan Disc includes three shorts that are two minutes long.
Music videos from both discs are not included in the entry, as they don't contain any new scenes.

The same specials were also included in the Blu-ray box set.",,2008,2008-08-29,,Gonzo,Comedy,354
38050,Shoujo☆Kageki Revue Starlight Specials,Revue Starlight Specials,Special,Original,3,Finished Airing,False,PG-13 - Teens 13 or older,6.93,4691,3711,7077,7,8850,"99.419 Saisun
With 50 days remaining until the Seishou Festival, the girls have their measurements taken for their costumes. Comparing herself to Mahiru Tsuyuzaki and Nana Daiba, Futaba Isurugi wishes that she was taller, believing a few extra centimeters would allow her to play other roles. Seeing Futaba's apprehension, Hikari Kagura is reminded of a story about a stage girl who—in spite of her short stature—rose to brilliance.

99.419 Touron
Junna Hoshimi walks into a passionate exchange between Hikari and Maya Tendou regarding the portrayal of Claire, one of the lead roles in the play Starlight. While Hikari and Maya have their own beliefs about how the character should be depicted, the three all come to acknowledge their ambition to be under the limelight of the stage.

99.419 Kaien   
On the opening day of the anticipated performance, Hikari is unexpectedly nervous. Having predicted such an outcome, the rest of the girls quickly work together to assist in her final preparations. Meanwhile, Karen Aijou swings for the fences to surprise Hikari with a gift.

[Written by MAL Rewrite]",,2018,2018-10-24,2019-02-27,Kinema Citrus,Comedy,355
5298,Yu☆Gi☆Oh! 5D's: Shinkasuru Kettou! Stardust vs. Red Demon's,,Special,Manga,1,Finished Airing,False,PG-13 - Teens 13 or older,6.93,4704,4917,6469,7,10946,"A non-canon Yu☆Gi☆Oh! 5D's special from the 2008 Super Jump Anime Tour. Yuusei Fudou and Jack Atlas face off in a Riding Duel for the title of Duel King, with Aki and the twins watching. The ace dragons, Stardust Dragon and Red Daemon's Dragon, clash once again, and this time gain the power to 'evolve' using the Buster Mode trap card, becoming ""Stardust Dragon/Buster"" and ""Red Demon's Dragon/Buster.""",,2008,2008-09-21,2008-11-23,Gallop,Fantasy;Sci-Fi,356
1953,Code Geass: Hangyaku no Lelouch Picture Drama,Code Geass: Lelouch of the Rebellion Picture Dramas,Special,Original,9,Finished Airing,False,PG-13 - Teens 13 or older,6.92,4722,24452,3222,77,51800,"At Ashford Academy, the girls get into juicy talks in the bath, and later plan a gender role reversal festival, which has everyone but Lelouch Lamperouge eager. The students also attend the grand opening of the Clovis Land pool, much to the scantily clad Cornelia li Britannia's embarrassment. Events from Lelouch's past show a chapter from his royal upbringing, and how he met Suzaku Kururugi. Code Geass: Hangyaku no Lelouch Picture Drama shows that when they are away from the bloodshed and agony of war, the characters live very different and often humorous lives.

[Written by MAL Rewrite]",,2007,2007-01-27,2007-09-25,Sunrise,Comedy;Slice of Life,357
15159,Fantastic Children: Befort no Kodomo-tachi no Sonogo,,Special,Unknown,1,Finished Airing,False,G - All Ages,6.92,4727,755,11586,2,2165,Extended ending showing what happened with Befort Children after the events from the last episode of the TV series. DVD release exclusive.,,2005,2005-09-23,,Nippon Animation,Slice of Life,358
13561,Guilty Crown: 4-koma Gekijou,,Special,4-koma manga,11,Finished Airing,False,R - 17+ (violence & profanity),6.92,4728,8315,4473,24,27371,Animated four-panel manga that comes as extra on the DVDs and Blu-rays.,,2012,2012-01-25,2012-11-21,Production I.G,Comedy,359
4205,KimiKiss Pure Rouge: Love Fighter,,Special,Visual novel,1,Finished Airing,False,PG-13 - Teens 13 or older,6.92,4731,7095,6044,5,12916,DVD only episode entitled 'love fighter'. It features the whole cast but focuses on Megumi Kuryuu.,,2008,2008-08-22,,J.C.Staff,Romance,360
34533,Nanbaka: Shusseki Bangou no Tsuita Baka-tachi!,Nanbaka: Idiots with Student Numbers!,Special,Web manga,1,Finished Airing,False,PG-13 - Teens 13 or older,6.92,4737,13545,4046,52,33853,"The official website for the Nanbaka television anime announced that the ""Nanfes"" event in April will screen a previously unreleased anime special.",,2017,2017-04-29,,Satelight,Action;Comedy,361
37921,ReLIFE: Kanketsu-hen Specials,,Special,Web manga,2,Finished Airing,False,PG-13 - Teens 13 or older,6.92,4743,10308,4578,26,26046,Two specials of ReLIFE: Kanketsu-hen released on mobile and later included on Blu-ray/DVD volume.,,2018,2018-03-21,,TMS Entertainment,Slice of Life,362
39591,Persona 5 the Animation Specials,,Special,Game,2,Finished Airing,False,R - 17+ (violence & profanity),6.91,4758,5808,5630,18,15476,"Unaired episodes included in 11th &amp; 12th BD/DVD volume of the Persona 5 the Animation. These volumes contained the two Persona 5 the Animation TV Specials (""Stars and Ours"" &amp; ""Dark Sun..."" respectively) rather than episodes of the regular TV series.

#1: Few days after battle against Akechi. Ren, who was helping out with the cafe, saw a cross word puzzle magazine on the table and saw Akechi's handwriting besides a solved crossword ""Seigi no Akashi (Sign of Justice)."" In order to investigate the meaning, he walks around the street under the cold winter snow while thinking back at the memory with Akechi. The meaning that revealed and Akechi's feeling is...

#2: Valentine's Day Omnibus Story featuring Ren Amamiya.",,2019,2019-05-29,2019-06-26,CloverWorks,Comedy;Slice of Life,363
40659,Senki Zesshou Symphogear XV: Senki Zesshou Shinai Symphogear,,Special,Original,4,Finished Airing,False,PG-13 - Teens 13 or older,6.91,4765,1403,9057,3,4705,Original short episodes featuring characters in super-deformed style. Bundled with Blu-ray/DVD volumes 3 to 6 of the anime.,,2019,2019-12-04,2020-03-04,Satelight,Comedy;Slice of Life,364
33994,Servamp Specials,,Special,Manga,4,Finished Airing,False,PG-13 - Teens 13 or older,6.91,4766,4353,5158,22,19502,"Sleepy Life of SERVAMP
When they are not busy battling supernatural threats, servamps and their Eves enjoy carefree day-to-day affairs and lighthearted quarrels. Naturally, while other servamps and Eves work through their own troubles, Kuro plays video games and dozes off—not much of a change from his usual sleepy self. 

Hai ni Mamireta Shoukei: All the world's a stage
During a fight, Hyde recalls the time he used his charm as a hedgehog to trick Licht Jekylland Todoroki—piano prodigy and self-proclaimed angel—into forming a blood bond and becoming his Eve.

[Written by MAL Rewrite]",,2016,2016-11-25,2017-02-24,Platinum Vision,Comedy;Fantasy,365
6344,"Shikabane Hime: Kuro – Soredemo, Hito to Shite","Corpse Princess: Kuro - Even So, As a Person",Special,Manga,1,Finished Airing,False,R - 17+ (violence & profanity),6.91,4769,6306,5541,9,16231,This special follows the story of how Isaki Shuuji and Ruo Minai became Contracted Priest and Shikabane Hime.,,2009,2009-08-05,,Gainax,Action;Horror;Supernatural,366
6489,Zero no Tsukaima: Princesses no Rondo Picture Drama,The Familiar of Zero: Rondo of Princesses Picture Drama,Special,Light novel,7,Finished Airing,False,PG-13 - Teens 13 or older,6.91,4781,22659,3236,66,51392,"Picture Drama episodes included in each DVD volumes of Zero no Tsukaima: Princesses no Rondo.

Episode Titles:
vol.1 「Maid's Afternoon: Whip of Love」(メイドの午後　愛のムチ編)
vol.2 「Maid's Afternoon: Afternoon for Two」(メイドの午後　二人きりの昼下がり編)
vol.3 「Maid's Afternoon: The Last Night」 (メイドの午後　最後の夜編)
vol.4 「Countess Butterfly's Graceful Day」 Prologue (バタフライ伯爵夫人の優雅な一日 序章)
vol.5 「Countess Butterfly's Graceful Day」 Chapter 1 (バタフライ伯爵夫人の優雅な一日 第1章)
vol.6 「Countess Butterfly's Graceful Day」 Chapter 2 (バタフライ伯爵夫人の優雅な一日 第2章)
vol.7 「Countess Butterfly's Graceful Day」 The Last Chapter (バタフライ伯爵夫人の優雅な一日 最終章)",,2008,2008-09-25,2009-03-25,J.C.Staff,Action;Adventure;Comedy;Fantasy;Romance;Ecchi,367
33658,Girls & Panzer: Kore ga Hontou no Anzio-sen desu! - Fushou Akiyama Yukari no Sensha Kouza,,Special,Original,1,Finished Airing,False,PG-13 - Teens 13 or older,6.91,4797,1515,8890,2,5000,Bundled with the Blu-ray and DVD release of Girls &amp; Panzer: Kore ga Hontou no Anzio-sen desu!.,,2014,2014-07-25,,Actas,,368
34777,"91 Days: Toki no Asase/Subete no Kinou/Ashita, Mata Ashita",91 Days: Shoal of Time/All Our Yesterdays/Tomorrow and Tomorrow,Special,Original,1,Finished Airing,False,R - 17+ (violence & profanity),6.9,4802,30672,3043,33,58087,"1. Toki no Asase (Shoal of Time)
2. Subete no Kinou (All Our Yesterdays)
3. Ashita, Mata Ashita (Tomorrow and Tomorrow)",,2017,2017-07-05,,Shuka,Action;Drama;Suspense,369
3266,Ai Yori Aoshi: Enishi - Miyuki,,Special,Manga,1,Finished Airing,False,PG-13 - Teens 13 or older,6.9,4803,9616,5270,14,18522,"Ai yori Aoshi: Enishi - Miyuki is a 16 minute Christmas special set before the beginning of the first season. 

Based on manga chapters 43-44 and would also fit as episode 21.5 of the first season.",,2003,2003-12-31,,J.C.Staff,Comedy;Drama;Romance;Ecchi,370
7728,Hellsing: Psalm of the Darkness,,Special,Manga,1,Finished Airing,False,R - 17+ (violence & profanity),6.9,4812,12105,3959,47,35171,Special that can be found on DVD. Contains animation not reused in the TV series.,,2001,2001-08-03,,Gonzo,Action;Supernatural,371
