id,title,title_english,type,source,episodes,status,airing,rating,score,rank,scored_by,popularity,favorites,members,synopsis,season,year,start,ending,studios,genres,ranking
23363,Ore no Imouto ga Konnani Kawaii Wake ga Nai.: Ore no Imouto ga Konnani Eroge na Wake Nai,,Special,Light novel,1,Finished Airing,False,PG-13 - Teens 13 or older,6.44,7477,2953,6871,5,9467,Gal game animation special included in DVD/Blu-ray Vol.8.,,2014,2014-01-22,,,Comedy;Romance,736
39315,Kekkaishi: Yoshimori no Omoi,,Special,Manga,1,Finished Airing,False,PG-13 - Teens 13 or older,6.43,7489,259,13979,1,1054,Recap of Kekkaishi included in DVD Vol.4.,,2007,2007-05-25,,Sunrise,Adventure;Comedy;Fantasy,737
10076,Kämpfer für die Liebe,Kämpfer für die Liebe,Special,Light novel,2,Finished Airing,False,PG-13 - Teens 13 or older,6.43,7489,34437,2911,45,63148,"A two-episode special. They are designated as Episodes 13 and 14, and the first episode is a direct sequel to the previous series while the second episode is about the trans-sex of Natsuru.",,2011,2011-03-06,,Nomad,Action;Comedy;Romance;Ecchi,738
33880,Kochira Katsushikaku Kameari Kouenmae Hashutsujo: Ryou-san no Sushi Kui Nee! - Choujou Maguro Taiketsu!!,,Special,Manga,2,Finished Airing,False,PG-13 - Teens 13 or older,6.43,7491,162,15494,1,685,A two part Kochikame special wherein Ryoutsu becomes involved in a sushi chef's dealings.,,2007,2007-09-30,2007-10-07,Gallop,Comedy,739
33881,Kochira Katsushikaku Kameari Kouenmae Hashutsujo: Washi to Ore!? - Bokura wa Asakusa Shounen Tanteidan!,,Special,Manga,2,Finished Airing,False,PG-13 - Teens 13 or older,6.43,7492,158,15469,0,691,An amazing time machine invention allows Ryoutsu to return to the years of his childhood.,,2008,2008-04-06,2008-04-13,Gallop,Comedy,740
17345,Senran Kagura Specials,,Special,Unknown,6,Finished Airing,False,PG-13 - Teens 13 or older,6.43,7515,7079,5222,25,18879,"Special, unaired, episodes released with the Senran Kagura BD/DVDs.",,2013,2013-03-27,2013-08-28,Artland,Ecchi,741
8713,Akai Ito,,Special,Original,1,Finished Airing,False,G - All Ages,6.43,7526,1300,11034,2,2542,"The film takes a simple idea—creating a picture using a simple thread—and transforms it into an engaging flow of animated images. From East Asian folklore, Okushita takes the symbol of the red string of fate. There are many variations of this ancient tale, but the main idea is that the gods tie men and women together who are destined as each other's soul mates together with a red thread.

An invisible red thread connects those who are destined to meet,
regardless of time, place, or circumstance.
The thread may stretch or tangle, but it will never break.
-ancient Chinese belief

(Source: Nishikata Film Review)",,2009,2009-01-01,,,Drama;Romance;Slice of Life,742
31683,Danchigai: Juusan Goutou Sentou Ikitai!!,,Special,4-koma manga,1,Finished Airing,False,PG-13 - Teens 13 or older,6.43,7540,13536,4748,9,23847,Unaired episode of Danchigai included on the Blu-ray/DVD volume.,,2015,2015-09-18,,Creators in Pack,Slice of Life,743
33024,Ginga Kikoutai Majestic Prince: Mirai e no Tsubasa,Majestic Prince Episode 25 – Wings to the Future,Special,Manga,1,Finished Airing,False,PG-13 - Teens 13 or older,6.43,7544,2885,7873,2,6747,"Team Fawn from Gurantseere Academy dreams of one day fighting beside the heroes of Team Rabbit. One day, they finally get their chance as the GDF launches another attack.

(Source: Crunchyroll)",,2016,2016-09-29,,Orange;Seven Arcs Pictures,Action;Sci-Fi,744
22745,Brothers Conflict: Setsubou,,Special,Novel,1,Finished Airing,False,PG-13 - Teens 13 or older,6.42,7557,10889,4817,19,23033,"Ema finds a special lamp that her father left for her. Ema and the brothers rub the lamp to find that something peculiar happens in front of them.

(Source: ANN)",,2014,2014-02-26,,Brain's Base,Romance,745
49869,Ganbare Douki-chan: Kakusa Shakai ni Nayamu Kaisha no Douki,Ganbare Douki-chan: The Coworker is Suffering from Social Inequality,Special,Web manga,1,Finished Airing,False,PG-13 - Teens 13 or older,6.42,7566,5834,5371,33,17551,Unaired episode 13 included with the Blu-ray release of Ganbare Douki-chan.,,2021,2021-12-24,,Atelier Pontdarc,Comedy;Romance;Ecchi,746
25861,Inugami-san to Nekoyama-san: Nekoyama-san to Onsen Ryokou,,Special,4-koma manga,1,Finished Airing,False,PG-13 - Teens 13 or older,6.42,7571,9339,5475,5,16684,Unaired episode bundled with the Blu-ray/DVD Box-Set.,,2014,2014-07-18,,Seven,Comedy;Girls Love,747
13757,Mashiro-iro Symphony: The Color of Lovers Picture Drama,Mashiroiro Symphony Picture Drama,Special,Visual novel,2,Finished Airing,False,PG-13 - Teens 13 or older,6.42,7584,3926,6551,4,10602,DVD/BD specials of Mashiroiro Symphony: The Color of Lovers.,,2012,2012-02-22,2012-05-23,Manglobe,Drama;Romance,748
31593,Rokka no Yuusha Picture Drama,,Special,Light novel,3,Finished Airing,False,PG-13 - Teens 13 or older,6.42,7592,2916,6057,9,12852,Picture dramas bundled with the Blu-ray and DVD volumes.,,2015,2015-09-16,2015-11-18,Passione,Action;Adventure;Fantasy;Mystery,749
6127,Toradora!: SOS! Kuishinbou Banbanzai,Toradora!: SOS! Hurray for Gourmands,Special,Light novel,4,Finished Airing,False,PG-13 - Teens 13 or older,6.41,7611,55193,2057,82,111180,"Toradora DVD shorts featuring the miniature forms of the Toradora characters talking about, and eating, food.",,2009,2009-02-03,2009-08-26,J.C.Staff,Comedy;Gourmet,750
12665,"Yuru Yuri: Doushite, Tomaranai, Tokimeki, Dokidoki, Paradox, Eternal","YuruYuri: For Whatever Reason, Never Ending, Heart Throbbing, Pitter-patter, Paradox Eternal",Special,Manga,1,Finished Airing,False,PG-13 - Teens 13 or older,6.41,7619,11705,4540,21,26627,"Yuru Yuri DVD/BD special.

Chinatsu's horrendous and atrocious drawings come to life in a tale about a handsome prince, a hideous girl and true love!

(Source: Anime-Planet)",,2011,2011-11-16,,Doga Kobo,Comedy;Girls Love,751
9857,Bakusou Kyoudai Let's & Go Special,,Special,Manga,1,Finished Airing,False,G - All Ages,6.41,7625,433,13437,2,1219,,,1996,1996-12-30,,Xebec,Adventure,752
40176,Miru Tights: Cosplay Satsuei Tights,Miru Tights: Cosplay Photoshoot Tights,Special,Original,1,Finished Airing,False,PG-13 - Teens 13 or older,6.41,7652,15015,4302,39,29453,"In the lead-up to a photoshoot in which Yua Nakabeni and Ren Aikawa have been invited to model for an illustrator, the two girls are feeling anxious. To help them out, their friend and fellow classmate Homi Moegi decides to run a practice shoot in hopes of easing their nerves.

Yua and Ren repeatedly tense up during shots on their own, so Homi asks them to pair up for some couple shots, hoping that they will relax in each other's company. What begins as a series of cute poses soon turns into an alluring collage of legs encased in black stockings layered over one another.

[Written by MAL Rewrite]",,2019,2019-08-23,,Yokohama Animation Laboratory,Ecchi,753
54196,One Piece 4D,,Special,Manga,1,Finished Airing,False,PG - Children,6.41,7653,1211,9279,17,4376,Original animation created as part of the Tokyo One Piece Tower theme park.,,2015,2015-03-13,,,Action;Adventure,754
30625,Princess Princess Specials,,Special,Manga,12,Finished Airing,False,PG-13 - Teens 13 or older,6.41,7659,646,11080,1,2509,Short omake episodes included on the Blu-ray/DVD volumes of Princess Princess.,,2006,2006-07-19,2006-12-20,Studio Deen,Comedy,755
33876,Kochira Katsushikaku Kameari Kouenmae Hashutsujo: Ryou-san to Chuuken Lucky Monogatari - Kameari Dai Houimou wo Kawase!!,,Special,Manga,1,Finished Airing,False,PG-13 - Teens 13 or older,6.4,7669,161,15513,0,682,A Kochikame television special.,,2005,2005-10-23,,Gallop,Comedy,756
25661,Mikan Enikki Specials,,Special,Manga,2,Finished Airing,False,G - All Ages,6.4,7672,190,15997,0,607,An extra episode and a special of the Mikan Enikki series included as a bonus on VHS/DVD's.,,1993,1993-08-24,,Nippon Animation,Fantasy;Slice of Life,757
12921,Morita-san wa Mukuchi. Specials,,Special,4-koma manga,2,Finished Airing,False,PG-13 - Teens 13 or older,6.4,7674,2433,9051,0,4717,"Unaired episodes of the ""Morita-san wa Mukuchi"" TV series bundled with the 5th manga volume.",,2012,2012-01-27,,Seven,Comedy;Slice of Life,758
37046,Drifters (OVA): Kokuou-sama Goranshin,,Special,Manga,1,Finished Airing,False,PG-13 - Teens 13 or older,6.39,7719,2101,7406,4,7831,Final episode of Kokuou-sama Goranshin released with the new Drifters episodes 13-14 Blu-ray disc.,,2017,2017-12-23,,Hoods Entertainment,Comedy,759
7083,Hakushaku to Yousei Specials,,Special,Light novel,6,Finished Airing,False,PG-13 - Teens 13 or older,6.39,7724,2907,6952,8,9223,"Chibi-Earl and Chibi-Fairy. Every special focuses on another character, who will in their turn recite a poem by Shakespeare, that they feel describes their lives the best.",,2008,2008-12-26,2009-05-29,Artland,Adventure;Fantasy,760
4760,Kanokon Specials,,Special,Light novel,12,Finished Airing,False,R+ - Mild Nudity,6.39,7730,15040,4041,27,33870,Uncensored 2-minute DVD Specials of Kanokon.,,2008,2008-06-25,2008-11-21,Xebec,Ecchi,761
6368,Legend of Regios,Legend of Regios,Special,Light novel,3,Finished Airing,False,R - 17+ (violence & profanity),6.39,7735,2886,6484,9,10872,"Legend of Regios was originally the English speaking cut-scenes on TV, that the characters in the Chrome Shelled Regios series were watching.

This special (which has been included with the DVD release of Chrome Shelled Regios) has reorganized the scenes, extended some, and has been re-dubbed completely in Japanese.  It's a side story within the Chrome Shelled Regios series.",,2009,2009-03-27,2009-05-29,Zexcs,,762
10739,Panty & Stocking in Sanitarybox,,Special,Original,1,Finished Airing,False,R - 17+ (violence & profanity),6.39,7746,21770,3642,61,41677,A special short included with the 5th DVD/BD release.,,2011,2011-04-28,,Gainax,Action;Avant Garde;Comedy;Supernatural;Ecchi,763
5742,Space Cobra Pilot,,Special,Manga,1,Finished Airing,False,PG-13 - Teens 13 or older,6.39,7749,1131,10745,1,2773,Pilot episode for the TV series.,,1981,1981-12-31,,Tokyo Movie Shinsha,Action;Adventure;Sci-Fi,764
35116,Warau Salesman Dai SP-banashi,,Special,Manga,8,Finished Airing,False,PG-13 - Teens 13 or older,6.39,7756,222,14745,0,852,Specials of Warau Salesman broadcasted intermittently during the main show not included in the episode count of the main show. They are 3 times the length of a normal episode and fill a half hour time-slot.,,1990,1990-01-23,1992-07-07,Shin-Ei Animation,Comedy;Drama;Supernatural,765
14957,Shakugan no Shana: Friagne & Marianne no Naze Nani Shana! Nandemo Shitsumonbako! 2,,Special,Light novel,8,Finished Airing,False,PG-13 - Teens 13 or older,6.38,7763,2329,7357,1,8014,A series of short specials where Friagne and Marianne explain different terms from the second season of Shakugan no Shana.,,2008,2008-01-25,2008-08-29,J.C.Staff,Comedy;Fantasy,766
5772,Akaneiro ni Somaru Saka: Hardcore,Akane Iro ni Somaru Saka Hardcore OVA,Special,Visual novel,1,Finished Airing,False,R+ - Mild Nudity,6.38,7775,22163,3674,31,41125,Everybody goes on vacation to Ayanokouji's private island for fun in the sun. Hilarity ensues.,,2009,2009-06-26,,TNK,Comedy;Romance;Ecchi,767
16119,Chouyaku Hyakuninisshu: Uta Koi. - Sake to Kikoushi: Murasaki Shikibu to Kintou,,Special,Manga,1,Finished Airing,False,PG-13 - Teens 13 or older,6.38,7792,503,11546,1,2189,A short episode bundled in Vol.6 of the BD/DVDs.,,2013,2013-02-27,,TYO Animations,Comedy,768
49913,"Hachigatsu no Cinderella Nine: Tsuzuku, Monogatari",Cinderella Nine: The Story Continues,Special,Game,1,Finished Airing,False,PG-13 - Teens 13 or older,6.38,7797,926,11919,4,1950,Special episode of Hachigatsu no Cinderella Nine (TV) sent to buyers of collector's edition of the Blu-ray.,,2021,2021-09-25,,TMS Entertainment,Sports,769
41191,Hikaru no Go Recaps,,Special,Manga,2,Finished Airing,False,PG-13 - Teens 13 or older,6.38,7801,291,13267,3,1274,Hikaru no Go recaps included on DVD 10 (Season 2 vol 1) which recaps episode 1-24 and DVD 19 (Season 3 vol 1) which recaps episode 25-52 of the TV series.,,2003,2003-01-29,2003-10-29,Pierrot,Supernatural,770
7017,K-On!: Ura-On!,K-On!: Ura-On!,Special,Original,7,Finished Airing,False,G - All Ages,6.38,7803,34513,2884,89,64413,"The seven Blu-ray disc volumes of K-ON! have an extra short anime ""Ura-ON!""",,2009,2009-07-29,2010-01-20,Kyoto Animation,Comedy,771
920,Nurse Witch Komugi-chan Magikarte Special,,Special,Original,1,Finished Airing,False,PG-13 - Teens 13 or older,6.38,7813,2924,8104,3,6281,"A TV special, known as episode 2.5, that takes place between episodes 2 and 3.

(Source: ANN)",,2003,2003-06-06,,Kyoto Animation;Tatsunoko Production,Comedy,772
4910,Pokemon: Pikachu no Wanpaku Island,Pikachu's Island Adventure,Special,Game,1,Finished Airing,False,PG - Children,6.38,7816,4881,6526,5,10696,"Pikachu and the other Pokémon were at the beach, when a weakened Wynaut approaches them. It tells them that its friends were attacked by Meowth and the other Team Rocket Pokémon, as well as an Exploud and a Hariyama, because Meowth wanted to take over their playground, which resides on a nearby island. After hearing Wynaut's story, Pikachu and the others decide to help them take back their playground, and begin to train them, so that they can rescue their island from the clutches of Meowth.

(Source: ANN)",,2006,2006-08-01,,OLM,Adventure;Comedy;Fantasy,773
58628,Kagami no Kojou no Mae to Ato,Lonely Castle in the Mirror: Before and After,Special,Novel,1,Finished Airing,False,PG-13 - Teens 13 or older,6.37,7825,131,18078,0,401,Special animation shown during a rescreening of the movie. Later included in the limited BD/DVD edition.,,2023,2023-05-26,,A-1 Pictures,Drama;Fantasy;Mystery,774
8302,Ladies versus Butlers! Specials,,Special,Light novel,6,Finished Airing,False,R+ - Mild Nudity,6.37,7827,17357,3920,34,35776,"DVD/BD specials featuring two female cast members of Ladies versus Butlers! at a time engaging in Lady Battles, where they try to outdo their opponent in eroticism and stripping.",,2010,2010-03-26,2010-08-27,Xebec,Ecchi,775
38179,Kino no Tabi: The Beautiful World - The Animated Series - Haikyo no Kuni - On Your Way,,Special,Light novel,27,Finished Airing,False,R - 17+ (violence & profanity),6.37,7828,596,9080,5,4679,,,2016,2016-07-23,2016-09-02,Lerche,Adventure,776
32481,Love Live! Kouhaku Special Anime,,Special,Original,1,Finished Airing,False,PG - Children,6.37,7830,2103,8289,5,5932,"A special anime shown at the 66th NHK Kouhaku Uta Gassen, prior to μ's' performance of the 2nd Season opening theme song, ""Sore wa Bokutachi no Kiseki"".",,2015,2015-12-31,,Sunrise,,777
39115,Uchuu Senkan Tiramisù II Specials,Space Battleship Tiramisu Zwei Specials,Special,Web manga,4,Finished Airing,False,PG-13 - Teens 13 or older,6.37,7850,1030,11040,0,2538,Unaired episodes included with the Blu-ray volume.,,2019,2019-01-30,,Gonzo,Comedy;Sci-Fi,778
31448,Yoku Wakaru Mahouka! - Saiseitte Nani?,,Special,Light novel,1,Finished Airing,False,PG-13 - Teens 13 or older,6.37,7854,4681,6125,11,12524,Extra episode of Mahouka Koukou no Rettousei: Yoku Wakaru Mahouka! included in the BD/DVD.,,2015,2015-02-25,,,Comedy,779
31530,Classroom☆Crisis: Tabi no Haji wa Uwanuri,,Special,Original,1,Finished Airing,False,PG-13 - Teens 13 or older,6.37,7866,1632,7849,2,6796,Unaired episode included with the third Blu-ray and DVD volume.,,2015,2015-12-23,,Lay-duce,Sci-Fi,780
33957,Danball Senki Wars: All Star Battle,,Special,Game,1,Finished Airing,False,G - All Ages,6.37,7868,339,13973,2,1054,"Arata Sena is unable to leave the island after he forgets to have his permission form signed. However, he gets an even better opportunity: facing off against LBX legend Ban Yamano.",,2014,2014-02-27,,OLM,Action,781
33498,Ganbare! Kickers Specials,Fight! Kickers,Special,Manga,3,Finished Airing,False,G - All Ages,6.37,7874,461,13956,0,1057,The 24-26th episodes aired as a special the following year by itself.,,1988,1988-01-05,,Pierrot,Comedy;Drama;Sports,782
33242,IS: Infinite Stratos 2 - Infinite Wedding,,Special,Light novel,1,Finished Airing,False,PG-13 - Teens 13 or older,6.37,7880,13726,3959,24,35087,Picture drama included on the IS: Infinite Stratos 2 Blu-ray BOX.,,2016,2016-06-30,,8bit,Comedy;Romance,783
10905,Ikoku Meiro no Croisée Picture Drama,La croisée dans un labyrinthe étranger Picture Drama,Special,Manga,6,Finished Airing,False,G - All Ages,6.37,7881,1513,9435,0,4152,Ikoku Meiro no Croisée Picture Drama.,,2011,2011-10-26,2012-03-21,Satelight,Slice of Life,784
2485,Doku Tenshi no Shippo,,Special,Unknown,7,Finished Airing,False,PG-13 - Teens 13 or older,6.36,7888,707,11772,4,2034,Tenshi no Shippo omake.,,2002,2002-01-25,2002-07-25,Tokyo Kids,Comedy;Fantasy;Romance,785
2617,Ghiblies,,Special,Original,2,Finished Airing,False,PG - Children,6.36,7893,2806,7415,6,7795,"Two Ghibli created shorts about the happenings in a fictional animation studio, presumably based to some extent on their own.",,2000,2000-04-08,2002-07-19,Studio Ghibli,Comedy,786
3190,Guitar wo Motta Shounen: Kikaider vs. Inazuman,The Boy Who Carried a Guitar: Kikaider vs. Inazuman,Special,Unknown,1,Finished Airing,False,PG-13 - Teens 13 or older,6.36,7898,576,12653,1,1530,The OVA Special which teams the Anime version of the legendary Henshin Hero Jiro/Jinzou Ningen Kikaider with another Toei Henshin Hero Inazuman.,,2003,2003-09-18,,Radix;Studio OX,Sci-Fi,787
1905,Harukanaru Toki no Naka de: Hachiyou Shou Specials,,Special,Visual novel,8,Finished Airing,False,PG-13 - Teens 13 or older,6.36,7899,979,10473,2,3005,Short clips about what happens after the TV series.,,2005,2005-09-23,2006-04-16,Yumeta Company,Fantasy;Romance;Supernatural,788
36992,Itou Junji: Collection - Tomie,,Special,Manga,2,Finished Airing,False,R - 17+ (violence & profanity),6.36,7903,19443,3520,140,44465,"Memories, both good and bad, suffuse the high school experience. Whether it's hanging out with friends or cramming for tests, everyone has something they will remember from that time in their lives. At a certain high school, one class is faced with an event that can cause people to look back on their high school days in sadness: the death of a student.

The deceased is not just any student—she's Tomie Kawakami, a popular girl with an almost otherworldly beauty. Her death was particularly gruesome: her body was dismembered and the pieces scattered. As the class tries to make sense of the situation, they are shocked when a familiar voice calls out to them from the doorway, apologizing for being late.

With raven hair and a beauty mark under her left eye, this girl is the spitting image of their murdered classmate. But she can't actually be Tomie, right?

[Written by MAL Rewrite]",,2018,2018-04-27,2018-05-25,Studio Deen,Drama;Horror;Supernatural,789
33875,Kochira Katsushikaku Kameari Kouenmae Hashutsujo: Ryoutsu vs. Nakimushi Idol!? Nihon 1-shuu Dai Sugoroku Game!!,,Special,Manga,1,Finished Airing,False,PG-13 - Teens 13 or older,6.36,7909,146,15623,0,663,A Kochikame special pitting Ryoutsu against Aidoru.,,2005,2005-03-27,,Gallop,Comedy,790
58925,Kuroko no Basket: Basket Kyoushitsu,Kuroko's Basketball: Basketball Classroom,Special,Manga,1,Finished Airing,False,PG-13 - Teens 13 or older,6.36,7910,132,16026,0,602,An original picture drama included with the Kuroko no Basket Thanks Disc: 10th Anniversary BD/DVD.,,2023,2023-03-24,,Production I.G,Sports,791
36485,Princess Principal Picture Drama,,Special,Original,6,Finished Airing,False,PG-13 - Teens 13 or older,6.36,7921,2890,7154,4,8606,Picture dramas bundled with the Blu-ray and DVD volumes.,,2017,2017-09-27,2018-02-23,Actas;Studio 3Hz,Slice of Life,792
6226,Utawarerumono Recaps,,Special,Visual novel,2,Finished Airing,False,PG-13 - Teens 13 or older,6.36,7932,1299,9256,0,4405,DVD recap episodes. The recaps are included in Utawarerumono DVD Volumes 4 and 5.,,2006,2006-11-22,2006-12-21,OLM,Action;Drama;Fantasy,793
31608,Teekyuu 4 Specials,Teekyu 4 Specials,Special,Manga,2,Finished Airing,False,PG-13 - Teens 13 or older,6.35,7946,3156,8118,0,6261,Unaired specials included in the Blu-ray and DVD release.,,2015,2015-08-28,,Millepensee,Comedy;Sports,794
4469,.hack//G.U. Trilogy: Parody Mode,.hack//G.U. Trilogy: Parody Mode,Special,Game,1,Finished Airing,False,PG-13 - Teens 13 or older,6.35,7954,4277,6463,10,10962,"A special bonus Parody Mode added to the extras of the .hack//G.U. Trilogy 

(Source: AniDB)",,2008,2008-03-25,,,Comedy;Fantasy;Sci-Fi,795
6579,Chikyuu Bouei Kazoku Special,The Daichis: Earth's Defence Family - Into the Depths of Marital Hell,Special,Original,1,Finished Airing,False,PG-13 - Teens 13 or older,6.35,7960,239,15326,0,711,"An alternative episode 11 (or episode 11.5) released on the DVD set of Chikyuu Bouei Kazoku. 

The world's first experience simulation game park ""Amber Crystal"" opened in Chiba Prefecture. Opening day only allows couples inside with a special ticket. Seiko and cameraman Hayakawa, Mamoru and Junko-sensei are there to meet up. While saying ""because it is a game, it's okay to do anything"", Mamoru guards as a knight figure to raise XP to steadily power up. Meanwhile, Seiko who became a mage, realized that this game park is the invasion of the space monster and goes on to approach the final boss of the game.",,2002,2002-11-25,,Group TAC,Action;Drama,796
707,Comic Party Specials,,Special,Visual novel,4,Finished Airing,False,PG-13 - Teens 13 or older,6.35,7963,1653,9438,3,4145,"The DVD Specials.

Kazuki, together with his friends, goes to a Comic Party that's going to be held in a hot spring. There, they make an incredible discovery that is going to reveal something amazing about comic conventions.",,2003,2003-01-13,,OLM,Comedy;Drama,797
1235,Ichitaka no Mousou Nikki,Ichitaka's Delusion Diary,Special,Manga,5,Finished Airing,False,R+ - Mild Nudity,6.35,7972,3561,7654,2,7215,"5 dream sequences, dubbed his delusions. Wet dreams from the imagination of a healthy young male.",,2005,2005-12-09,2006-05-26,Pierrot;Arms,Comedy;Romance;Ecchi,798
23943,Kidou Senshi Gundam UC: One of Seventy Two,Mobile Suit Gundam Unicorn: One of Seventy Two,Special,Novel,1,Finished Airing,False,PG-13 - Teens 13 or older,6.34,7997,504,10697,1,2820,"U.C. 0095.12.03 The Neo Zeon remnants known as the Sleeves conduct a performance test on a certain new type of mobile suit in a debris sector. Having gotten wind of this intel, two warships head for the debris sector. One ship is a Earth Federation Forces warship. The other ship is an Anaheim Electronics testing ship. On board the Federation Forces battleship, a newly constructed Unicorn Gundam Unit 3 awaited its time to sortie…

(Source: Zeonic Scanlations)",,2013,2013-08-03,,Sunrise,,799
10949,Koukaku Kidoutai: Stand Alone Complex - Tachikoma na Hibi - Interval,Ghost in the Shell: Stand Alone Complex: Tachikomatic Days Fan Disc,Special,Unknown,3,Finished Airing,False,G - All Ages,6.34,7998,1500,8074,1,6339,Tachikomatic Days shorts released on a fan disc compilation.  Later re-released on a BD box with all the Tachikoma shorts.,,2004,2004-02-25,,Production I.G,Comedy;Sci-Fi,800
24935,Recorder to Randoseru Mi☆ Special,,Special,4-koma manga,1,Finished Airing,False,PG-13 - Teens 13 or older,6.34,8011,3787,7681,1,7158,Unaired episode 13 included on the Blu-ray/DVD volume of the Recorder to Randoseru Mi☆ series.,,2013,2013-10-02,,Seven,Comedy;Slice of Life,801
1012,Sexy Commando Gaiden: Sugoi yo!! Masaru-san Specials,,Special,Manga,2,Finished Airing,False,R - 17+ (violence & profanity),6.34,8015,868,12046,1,1878,Recap episodes.,,1998,1998-04-02,1998-04-03,Magic Bus,Comedy,802
22361,Shichinin no Nana: Oshougatsu da yo! 7 x 7 = 49-nin no Nana?,New Year Special: It's New Year's! 7 x 7 = 49 Nanas?,Special,Unknown,1,Finished Airing,False,PG-13 - Teens 13 or older,6.34,8017,329,14388,0,939,"On New Year's Day, Nana Suzuki is disappointed when she has to share her holiday allowance with her six clones. However, the hyper-intelligent Nanasama hypothesizes that they can use the invention that cloned Nana to increase their allowance. Things don't go so smoothly this time either, though, as chaos ensues when Nana multiplies again—this time into 49 copies! 

[Written by MAL Rewrite]",,2002,2002-10-02,,A.C.G.T.,Adventure;Comedy,803
6743,Utawarerumono OVA Picture Drama,,Special,Visual novel,3,Finished Airing,False,PG-13 - Teens 13 or older,6.34,8022,2070,8344,3,5856,Bonus specials released together with the OVA.,,2009,2009-06-24,2010-06-23,,Comedy;Fantasy,804
39709,Amanchu!: Upyopyo Dive Tsukkome! Umi no Sekai!,,Special,Manga,6,Finished Airing,False,PG-13 - Teens 13 or older,6.34,8027,642,10198,3,3257,Special shorts included on the Blu-ray volumes 2-7 of Amanchu!.,,2016,2016-10-26,2017-03-29,J.C.Staff,Comedy,805
35805,Cinderella Girls Gekijou Specials,THE IDOLM@STER CINDERELLA GIRLS Theater,Special,4-koma manga,2,Finished Airing,False,PG-13 - Teens 13 or older,6.34,8034,640,10677,0,2835,Unaired episodes of Cinderella Girls Gekijou included in the DVD and Blu-ray release.,,2017,2017-06-28,2017-07-26,Gathering;Lesprit,Comedy;Slice of Life,806
17205,Cowboy Bebop: Ein no Natsuyasumi,Cowboy Bebop: Ein's Summer Vacation,Special,Original,1,Finished Airing,False,G - All Ages,6.34,8035,12828,4209,33,30888,"A Corgi can certainly dream! Taking a break from the frequent antics his colleagues get him into, Bebop crewmate Ein envisions himself sipping a tropical beverage on the beachside and scuba diving with Edward amid a barrier reef. 

In this ""picture drama,"" Ein fantasizes about his ideal summer vacation.

[Written by MAL Rewrite]",,2012,2012-12-21,,Sunrise,Comedy,807
17020,D.C.III: Da Capo III Special,,Special,Visual novel,1,Finished Airing,False,PG-13 - Teens 13 or older,6.34,8037,2138,8369,2,5820,Special that counts down the best of the Da Capo theme songs and introduces the characters of Da Capo III.,,2012,2012-12-31,,Kazami Gakuen Koushiki Douga-bu,Drama;Romance,808
